Sr. No.,OEM Type,OEM Name,City/District,State,Contact Phone,Contact Email,Uses ABB Motors,Source/Notes
1,Pumps - Industrial / Agricultural,Kirloskar Brothers Ltd,Pune,Maharashtra,1800-123-4443,N/A,Potential,Manufactures a wide range of industrial and agricultural pumps; as a market leader they would source from top-tier suppliers like ABB
2,Pumps - Industrial / Water,KSB Pumps Ltd.,Pune,Maharashtra,1800-233-1299,N/A,Confirmed,Third-party supplier lists a KSB pump model explicitly paired with an ABB motor
3,Pumps - Consumer / Agricultural,Crompton Greaves Consumer Electricals Limited,Mumbai,Maharashtra,9228880505,consumer.support@crompton.co.in,Potential,Major manufacturer of pumps and motors; likely sources from or competes with ABB
4,Pumps - Industrial / Water,Grundfos Pumps India Pvt. Ltd.,Chennai,Tamil Nadu,+91-44-4596-6800,contact.india@sales.grundfos.com,Potential,Global leader with high-quality standards; ABB is a logical potential supplier for their premium products
5,Pumps - Solar / Agricultural,Shakti Pumps (India) Ltd,Pithampur,Madhya Pradesh,+91-7292-410500,info@shaktipumps.com,Potential,Leading solar pump manufacturer; would require high-efficiency motors a key ABB offering
6,Pumps - Agricultural / Domestic Submersible,Falcon Pumps Private Limited,Rajkot,Gujarat,+91-97277-00568,sales@falconpumps.in,Potential,Leading manufacturer in the Rajkot cluster produces standard pumps compatible with ABB motors
7,Pumps - Agricultural / Domestic,Taro Pumps (Texmo Industries),Coimbatore,Tamil Nadu,1800-102-8888,info@taropumps.com,Potential,Major player in the Coimbatore hub manufactures its own motors but could source for specialized applications
8,Pumps - Agricultural / Domestic,CRI Pumps Pvt. Ltd.,Coimbatore,Tamil Nadu,1800-121-1243,customercare@crigroups.com,Potential,A dominant market leader in agricultural pumps; while they have extensive in-house motor manufacturing they may source for specific requirements
9,Pumps - Industrial / Consumer,Havells India Ltd.,Noida,Uttar Pradesh,080-45-77-1313,customercare@havells.com,Potential,Large electricals conglomerate that manufactures pumps; potential for sourcing high-efficiency motors
10,Pumps - Industrial / Power,CG Power and Industrial Solutions Limited,Mumbai,Maharashtra,+91-22-2423-7700,help@cgglobal.com,Potential,Major competitor to ABB in the motor space but could potentially source for specific integrated solutions
11,Pumps - Agricultural / Domestic,Oswal Pumps Ltd.,Karnal,Haryana,+91-9896266691,info@oswalpumps.com,Potential,Fast-growing company in solar and agricultural pumps a key target market for ABB's efficient motors
12,Pumps - Submersible / Domestic,Lubi Submersibles Ltd.,Ahmedabad,Gujarat,+91-79-61700100,service@lubipumps.com,Potential,Large manufacturer of submersible pumps and induction motors; could be a customer or competitor
13,Pumps - Industrial Process,Flowchem Engineering Pvt. Ltd.,Ahmedabad,Gujarat,N/A,N/A,Potential,Specializes in industrial process pumps requiring reliable motors that meet industry standards making ABB a suitable partner
14,Pumps - Chemical Process,Chemlin Pumps & Valves Pvt. Ltd.,Kolhapur,Maharashtra,+91-231-2653123,sales@chemlinindia.com,Potential,Focus on corrosion-resistant pumps for chemical industries suggests a need for specialized high-reliability motors like those offered by ABB
15,Pumps - Industrial / Submersible,Deccan Industries,Coimbatore,Tamil Nadu,+91-422-2531063,deccan@deccanindustries.com,Potential,Specifies NEMA Standard motors which are a core part of ABB's product portfolio
16,Pumps - Chemical Process,JEE Pumps,Ahmedabad,Gujarat,1800-233-8787,info@jeepumps.com,Potential,Reputed manufacturer of chemical process pumps a key application area for ABB's specialized industrial motors
17,Pumps - Industrial / Submersible,Darling Pumps,Indore,Madhya Pradesh,+91-9981992838,info@darlingpumps.in,Potential,Offers a wide range of submersible pumps for demanding applications like slurry and hot water requiring robust motors
18,Pumps - Submersible,Pluga Pumps & Motors Pvt. Ltd.,Vadodara,Gujarat,1800-313-1381,pluga@pluga.com,Inferred,Factory is located near an ABB facility suggesting a strong logistical and potential supply relationship
19,Pumps - Positive Displacement,Roto Pumps Ltd,Noida,Uttar Pradesh,+91-120-2567902,contact@rotopumps.com,Potential,Global player in positive displacement pumps; their industrial focus makes them a target for ABB's reliable motor solutions
20,Pumps - Chemical Process,Akay Industries Pvt. Ltd.,Hubli,Karnataka,+91-836-2486001,business@akayind.co.in,Potential,Long-standing manufacturer of high-quality centrifugal pumps for process industries compatible with standard industrial motors
21,Pumps - Industrial Process,Egger Pumps India P Ltd,Coimbatore,Tamil Nadu,+91-8044464738,N/A,Confirmed,A third-party lists an "Abb Motor With Egger Pump" for sale. Furthermore ABB and Egger have a global partnership for developing smart sensor technology for pumps
22,Pumps - Submersible / Agri,Angel Pumps (P) Ltd.,Rajkot,Gujarat,+91-2827-287150,info@pumpsangel.com,Potential,Key player in the Rajkot cluster manufacturing a wide range of standard pumps for which ABB motors would be suitable
23,Pumps - Submersible / Agri,Duke Plasto Technique Pvt. Ltd.,Palanpur,Gujarat,+91-9428505909,info@dukeplasto.com,Potential,Manufactures NEMA standard pumps and motors making them technically compatible with ABB's NEMA motor range
24,Pumps - Submersible / Agri,MBH Pumps (Guj) P Ltd,Ahmedabad,Gujarat,+91-79-22823066,parth@mbhpumps.com,Inferred,Distributor listings on B2B platforms show MBH pumps alongside offerings for ABB motors suggesting a common pairing
25,Pumps - Submersible / Agri,Nesa Pumps P Ltd,Ahmedabad,Gujarat,+91-79-22805058,support@nesapumps.com,Potential,Prominent manufacturer of submersible pumps in the Ahmedabad cluster a key target for high-volume motor suppliers
26,Pumps - Industrial / Agricultural,Usha International Limited,New Delhi,Delhi,1800-1033-111,N/A,Potential,Diversified company with a range of pumps; would source motors from established suppliers for quality and reliability
27,Pumps - Industrial Process,Sujal Engineering Pvt Ltd,Ahmedabad,Gujarat,+91-7984428720,sujalpumps@gmail.com,Potential,Serves numerous industries including chemical and pharmaceutical requiring high-quality reliable motors
28,Pumps - Industrial / Water,Flowserve India Controls Private Limited,Coimbatore,Tamil Nadu,+91-8048262280,N/A,Inferred,Distributor in Coimbatore lists "Abb Electric Motor" alongside Flowserve's product categories indicating a likely supplier relationship in the region
29,Pumps - Agricultural / Domestic,Suguna Pumps,Coimbatore,Tamil Nadu,+91-422-2223512,suguln@gmail.com,Potential,Major player in Coimbatore with a wide range of pumps and motors; a potential high-volume customer
30,Pumps - Industrial / Domestic,Sarvo Technologies Ltd,Faridabad,Haryana,N/A,info@sarvo.com,Potential,Manufactures monobloc pumps and water treatment solutions; ABB offers servo motors and drives that could be integrated into their systems
31,Pumps - Industrial / Chemical,Chemtrols Industries Pvt. Ltd.,Mumbai,Maharashtra,N/A,N/A,Inferred,A distributor listing explicitly mentions "Abb Vortex Flow Meter" in the context of Chemtrols products indicating an existing relationship with ABB's automation division
32,Pumps - Industrial Process,Tapflo Dev Industries,N/A,N/A,+1-949-752-7860,sales@pumportal.com,Potential,Global manufacturer of industrial pumps for chemical and process industries aligning with ABB's target segments
33,Pumps - Industrial / Water,Waterman Industries P Ltd,N/A,N/A,N/A,N/A,Potential,Focus on water supply and building services aligns with a key application segment for ABB motors and drives
34,Pumps - Submersible,Arvind Pumps P Ltd,Ahmedabad,Gujarat,+91-79-561015,N/A,Potential,Part of the dense Ahmedabad pump cluster manufacturing standard submersible pumps
35,Pumps - Industrial,Algo Fluid Systems Pvt. Ltd.,Gandhinagar,Gujarat,N/A,N/A,Potential,Member of the Indian Pump Manufacturers' Association indicating a significant presence in the industrial fluid handling sector
36,Pumps - Submersible,Aquasub Engineering (Texmo),Coimbatore,Tamil Nadu,+91-422-2642484,aquasub@vsnl.com,Potential,A key entity within the Texmo group a major force in the Coimbatore agricultural pump market
37,Pumps - Industrial,Chandra Pumps Pvt Ltd,Meerut,Uttar Pradesh,N/A,N/A,Potential,Established manufacturer of industrial pumps serving markets outside the main clusters
38,Pumps - Industrial / Water,Flowwell Pumps,N/A,Gujarat,+91-9898902456,flowellpump@gmail.com,Potential,Provider of water pumping solutions with over 40 years of experience a target for standard motor sales
39,Pumps - Industrial / Chemical,Indo Pump,Nashik,Maharashtra,+91-9011066239,sales@indopump.com,Potential,Specializes in centrifugal and process pumps requiring reliable industrial-grade motors
40,Pumps - Industrial / Chemical,Klaus Union Engg India P Ltd,Pune,Maharashtra,N/A,info@klaus-union.com,Potential,Indian arm of a German specialist in sealless magnetic drive pumps for chemical/petrochemical industries a high-value segment for ABB
41,Pumps - Chemical Dosing,Matz Pumps P Ltd,N/A,N/A,N/A,N/A,Potential,Leading supplier of chemical dosing pumps since 1967; their precision applications could benefit from ABB's advanced motor controls
42,Pumps - Progressive Cavity,Panchal Pumps & Systems,Kanpur,Uttar Pradesh,08048966370,N/A,Inferred,A distributor in Kanpur explicitly lists a "PANCHAL Borehole Lineshaft Pump Driven By Electric Motor" alongside "3phase Motor (ABB)"
43,Pumps - Industrial / Chemical,Super Flow Pumps P Ltd,Navi Mumbai,Maharashtra,+91-22-27782842,N/A,Potential,Manufacturer of chemical process and slurry pumps operating in the industrial hub of Maharashtra
44,Pumps - Mechanical Seals,Sealmatic India P Ltd,Mumbai,Maharashtra,+91-22-50502700,info@sealmaticindia.com,Potential,Not a pump OEM but a key supplier of mechanical seals to the industry. A partnership could provide indirect access to pump OEMs
45,Pumps - Mechanical Seals,Hi Fab Engineers p Ltd,Mumbai,Maharashtra,08047636446,N/A,Potential,Leading manufacturer of mechanical seals for pumps and mixers serving the same industrial customers as ABB
46,Pumps - Engineering Services,Unicorn Engineers,N/A,N/A,+91-9995-525-588,info@unicornpower.com,Inferred,A distributor lists "Vibratory Motor" from Unicorn Engineers alongside various ABB electric motors suggesting a channel partnership
47,Pumps - Industrial / Chemical,Amin Engineering,Vadodara,Gujarat,+91-9067118700,info@amineng.com,Potential,Specializes in precision machining and components for process industries including pumps a key target for motor integration
48,Pumps - Industrial / Trading,Melkev Machinery,Mumbai,Maharashtra,08048972138,N/A,Potential,Trader and supplier of various industrial pumps and motors; could be a channel partner for distributing ABB motors with pumps
49,Pumps - Valve Automation,Auma India Private Limited,Bangalore,Karnataka,+91-80-2839-4365,info@auma.co.in,Potential,Leading manufacturer of electric actuators for valves a related industry. ABB motors could be used in their actuator assemblies
50,Pumps - Industrial Valves,Advance Valves Private Limited,Noida,Uttar Pradesh,+91-120-479-6900,info@advancevalves.com,Potential,Manufactures motor-operated valves; ABB is a potential supplier for the electric motors used in these automated valve systems
51,Compressors - Refrigeration/Industrial Air/Process Gas,Kirloskar Pneumatic Company Limited,Pune,Maharashtra,N/A,N/A,Information Unavailable,Leading compressor manufacturer
52,Compressors - Refrigeration,Emerson Climate Technologies (Copeland Compressors),Gurugram,Haryana,N/A,sanjay.kapoor@emerson.com,Information Unavailable,Global HVAC solutions
53,Compressors - Industrial Air/Gas Compressors/Process Gas,Atlas Copco (India) Private Ltd.,Pune,Maharashtra,+91 77680 80901,info.compressor@atlascopco.com,Yes,Uses ABB Motors/Components
54,Compressors - Industrial Air,FS-Curtis India,Pune,Maharashtra,+91 8956964864,abhineet@fselliott.in,Information Unavailable,Air compressor specialist
55,Compressors - Refrigeration,Freezeking,Delhi (Kirti Nagar),Delhi,+91 9899 7010 28,freezekingindustries@gmail.com,Information Unavailable,Refrigeration compressor manufacturer
56,Compressors - Refrigeration,Bitzer India Private Limited,Mumbai,Maharashtra,N/A,harvinder.bhatia@bitzer.in,Information Unavailable,German refrigeration compressor manufacturer
57,Compressors - Refrigeration,Frascold India,Mumbai,Maharashtra,N/A,N/A,Information Unavailable,Italian refrigeration compressor manufacturer
58,Compressors - Refrigeration,Highly Electric Company (India),Ahmedabad (Matoda Sanand),Gujarat,+91-2717-392899,sales@highly.co.in,Information Unavailable,Electrical and refrigeration equipment
59,Compressors - Gas Compressors,Indian Compressors Ltd.,New Delhi (Okhla Industrial Estate) Greater Noida,Delhi Uttar Pradesh,+91 11 41206000,sales@didwania.com,Information Unavailable,Gas compression solutions
60,Compressors - Industrial Air/Gas Compressors,Bharat Pumps & Compressors Limited,Naini Allahabad,Uttar Pradesh,0532-2687417,cmd@bharatpumps.co.in,Information Unavailable,Industrial pump and compressor manufacturer
61,Compressors - Industrial Air/Gas Compressors,Adson Engineering Corporation,Ahmedabad (Amraiwadi),Gujarat,+91 9898588855,info@adsoncompressor.com,Information Unavailable,Industrial compressor manufacturer
62,Compressors - Process Gas Compressors,Deep Industries Limited,Ahmedabad (Ambli),Gujarat,+91 2717-298520,info@deepindustries.com,Information Unavailable,Process gas compression specialist
63,Compressors - Industrial Air,Indo-Air Compressors Private Limited,Ahmedabad (Kathwada GIDC Estate),Gujarat,+91 79 2290 1951,info@indoair.com,Information Unavailable,Air compressor manufacturer
64,Compressors - Industrial Air/Refrigeration,Bhosale Brothers,Pune,Maharashtra,+91 8624068484,bhosalebrothers123@gmail.com,Information Unavailable,Industrial equipment manufacturer
65,Compressors - Industrial Air/Refrigeration,Colt Equipments Private Limited,Sonepat (Nathupur),Haryana,N/A,N/A,Information Unavailable,Industrial equipment manufacturer
66,Compressors - Industrial Air,ELGi Equipments Limited,Coimbatore,Tamil Nadu,1800-425-3544,enquiry@elgi.com,Information Unavailable,Leading air compressor manufacturer
67,Compressors - Industrial Air,BAC Compressors,Coimbatore,Tamil Nadu,N/A,N/A,Information Unavailable,Air compressor manufacturer
68,Compressors - Industrial Air/Refrigeration,Tecumseh Products India Private Limited,Hyderabad,Telangana,+91 9810409860,sudeep.katiyar@tecumseh.com,Information Unavailable,Global compressor manufacturer
69,Compressors - Industrial Air/Gas Compressors,Jyotech Engineering & Marketing Consultants,Noida,Uttar Pradesh,N/A,N/A,Information Unavailable,Engineering consultancy and equipment
70,Compressors - Industrial Air/Gas Compressors,Comptech Equipments Limited (CEL),Gandhinagar,Gujarat,N/A,N/A,Information Unavailable,Industrial equipment manufacturer
71,Compressors - Industrial Air/Gas Compressors,Burckhardt Compression India Private Limited,Vadodara,Gujarat,N/A,N/A,Information Unavailable,Swiss compression technology
72,Compressors - Refrigeration,Sea Bird Refrigeration Private Limited,Delhi,Delhi,N/A,N/A,Information Unavailable,Refrigeration equipment manufacturer
73,Compressors - Industrial Air,Anest Iwata Motherson Private Limited,Noida,Uttar Pradesh,N/A,N/A,Information Unavailable,Japanese air compressor technology
74,Compressors - Industrial Air,Sriram Air Compressors (Coimbatore) Private Limited,Coimbatore,Tamil Nadu,N/A,N/A,Information Unavailable,Regional air compressor manufacturer
75,Compressors - Industrial Air,Eskay Engineering Systems,Coimbatore,Tamil Nadu,N/A,N/A,Information Unavailable,Engineering and air compressor systems
76,Compressors - Industrial Air,Balaji Compressors,Tirupur,Tamil Nadu,N/A,N/A,Information Unavailable,Air compressor manufacturer
77,Compressors - Industrial Air/Refrigeration,Premier Industries,Coimbatore,Tamil Nadu,N/A,N/A,Information Unavailable,Industrial equipment manufacturer
78,Compressors - Industrial Air/Refrigeration,Mayekawa India Private Limited,Gurgaon,Haryana,N/A,N/A,Information Unavailable,Japanese industrial refrigeration
79,Compressors - Industrial Air,Pryes compressors Private Limited,Tiruppur,Tamil Nadu,N/A,N/A,Information Unavailable,Air compressor manufacturer
80,Compressors - Industrial Air,Premier Compressor,Coimbatore,Tamil Nadu,N/A,N/A,Information Unavailable,Air compressor manufacturer
81,Compressors - Refrigeration,Mittal Refrigerations,New Delhi,Delhi,N/A,N/A,Information Unavailable,Refrigeration equipment manufacturer
82,Compressors - Industrial Air,Boss Air Compressor,Mumbai,Maharashtra,N/A,N/A,Information Unavailable,Air compressor manufacturer
83,Compressors - Industrial Air,Aakash Engineering Works,Coimbatore,Tamil Nadu,N/A,N/A,Information Unavailable,Engineering and air compressor systems
84,Compressors - Industrial Air,RMP Compressor,Coimbatore,Tamil Nadu,N/A,N/A,Information Unavailable,Air compressor manufacturer
85,Compressors - Industrial Air,Manifold Engineers,Rajkot,Gujarat,N/A,N/A,Information Unavailable,Engineering and compressor systems
86,Compressors - Industrial Air/Gas Compressors,GHH Borsig India Private Limited,Vadodara,Gujarat,N/A,N/A,Information Unavailable,German engineering and compression technology
87,Compressors - Industrial Air,Neelgiri's Compressors Company,Coimbatore,Tamil Nadu,N/A,N/A,Information Unavailable,Air compressor manufacturer
88,Compressors - Industrial Air,National Equipment Company,Coimbatore,Tamil Nadu,N/A,N/A,Information Unavailable,Industrial equipment manufacturer
89,Compressors - Industrial Air,Airmax Equipments,Coimbatore,Tamil Nadu,N/A,N/A,Information Unavailable,Air compressor and equipment manufacturer
90,Compressors - Industrial Air,J.K.Enterprises,Pune,Maharashtra,N/A,N/A,Information Unavailable,Industrial equipment supplier
91,Compressors - Industrial Air/Refrigeration,Cooling Systems Inc.,Faridabad,Haryana,N/A,N/A,Information Unavailable,Cooling and refrigeration systems
92,Compressors - Distributor/Supplier,North India Compressors,Delhi,Delhi,N/A,N/A,Information Unavailable,Compressor distributor and supplier
93,Compressors - Industrial Air,Mark Compressors India,Pune,Maharashtra,N/A,jayesh.kashyap@mark-compressors.com,Information Unavailable,Air compressor manufacturer
94,Compressors - Refrigeration,Embraco,Navi Mumbai,Maharashtra,+91 9998124624,vinod.maloo.synergy@nidec-ga.com,Information Unavailable,Global refrigeration compressor manufacturer
95,Compressors - Refrigeration,Frick India Ltd.,New Delhi,Delhi,+91 9810126276,anupam@frickmail.com,Information Unavailable,Industrial refrigeration systems
96,Compressors - Refrigeration,Rockwell Industries Ltd.,Hyderabad,Telangana,N/A,ashokg@rockwell.co.in,Information Unavailable,Refrigeration equipment manufacturer
97,Compressors - Refrigeration,Sidwal Refrigeration Industries Ltd.,Faridabad,Haryana,+91 9818180000,ranbir@sidwal.com,Information Unavailable,Refrigeration systems manufacturer
98,Compressors - Automotive AC,Subros Ltd,Noida,Uttar Pradesh,N/A,msethi@subros.com,Information Unavailable,Automotive air conditioning systems
99,Compressors - Refrigeration,Super Refrigeration (India) Pvt. Ltd.,New Delhi,Delhi,+91 9891182940,info@superefrigeration.com,Information Unavailable,Refrigeration equipment manufacturer
100,Compressors - Refrigeration,Superfreeze India Ltd.,Gurgaon,Haryana,+91 9810048749,mainisk@superfreeze.com,Information Unavailable,Industrial refrigeration systems
101,Compressors - Refrigeration,Tropikal Comfort Pvt. Ltd.,Jalna,Maharashtra,+91 9422927364,tropikalcomfort@gmail.com,Information Unavailable,Refrigeration and comfort systems
102,Compressors - Refrigeration,Aircon Refrigeration Co. Delhi,New Delhi,Delhi,+91 9811253434,tpsmehar@hotmail.com,Information Unavailable,Refrigeration equipment and services
103,Compressors - Refrigeration,Airfreeze Enterprises,Bengaluru,Karnataka,N/A,airfreezeenterprise@gmail.com,Information Unavailable,Refrigeration equipment manufacturer
104,Compressors - Refrigeration,Bothra Electric & Refrigeration Co.,Ahmedabad,Gujarat,+91 9327482763,bothraref@yahoo.com,Information Unavailable,Electrical and refrigeration equipment
105,Compressors - Refrigeration,Delhi Refrigeration Corporation,New Delhi,Delhi,+91 9312274285,delrefco@hotmail.com,Information Unavailable,Refrigeration equipment manufacturer
106,Compressors - Refrigeration,Ever Cool Refregeration,Kochi,Kerala,+91 9388619953,ever.coooll@gmail.com,Information Unavailable,Refrigeration systems
107,Compressors - Refrigeration,Royal Electronics,Roorkee,Uttarakhand,+91 9917266861,royalrefrigerationworks80@gmail.com,Information Unavailable,Electronics and refrigeration equipment
108,Compressors - Aircon,Sai Aircon,Aurangabad,Maharashtra,+91 9850023777,saiaircon@gmail.com,Information Unavailable,Air conditioning systems
109,Compressors - Refrigeration,Tempcon,Kolkata,West Bengal,+91 9830040717,info@tempcon.co.in,Information Unavailable,Temperature control and refrigeration
110,Compressors - Gas Compressors,Sukan Engineering Pvt Ltd,Mumbai,Maharashtra,N/A,N/A,Information Unavailable,Gas compression engineering
111,Compressors - Compressors (Various),Indmark,N/A,Maharashtra,N/A,N/A,Information Unavailable,Industrial compressor manufacturer
112,Compressors - Gas Compressors,KAL ENERGY INDIA PVT. LTD.,N/A,N/A,N/A,N/A,Information Unavailable,Energy and gas compression solutions
113,Compressors - Industrial Compressors,GASAIR MULTITECH LLP,N/A,N/A,N/A,N/A,Information Unavailable,Gas and air compression technology
114,Compressors - Compressors (Various),Toshniwal Brothers SR Private Limited,N/A,Karnataka,N/A,N/A,Information Unavailable,Industrial equipment manufacturer
115,Compressors - Air Compressors,Reliable Pneumatic,Secunderabad,Telangana,N/A,N/A,Information Unavailable,Pneumatic and air compression systems
116,Compressors - Compressors (Various),Powertherm Engg. Private Limited,Hyderabad,Telangana,N/A,N/A,Information Unavailable,Power and thermal engineering
117,Compressors - Reciprocating Compressors,Metro International,Kolkata,West Bengal,N/A,N/A,Information Unavailable,Reciprocating compressor specialist
118,Compressors - Air Compressors,Standard Engineering Company,Ahmedabad,Gujarat,N/A,N/A,Information Unavailable,Standard engineering and air compressors
119,Compressors - High Pressure Gas Compressors,Sulzer India Limited,Pune,Maharashtra,N/A,N/A,Information Unavailable,Swiss high pressure compression technology
120,Compressors - Reciprocating Compressors,IDEX India Private Limited,Mumbai,Maharashtra,N/A,N/A,Information Unavailable,Reciprocating compressor systems
121,Compressors - Reciprocating Compressors,Gayatri Engineering Company Private Limited,Ahmedabad,Gujarat,N/A,N/A,Information Unavailable,Engineering and compressor manufacturing
122,Compressors - Air Compressors,Selwel Enterprises Private Limited,Aurangabad,Maharashtra,N/A,N/A,Information Unavailable,Air compressor manufacturing and services
123,Compressors - Air Compressors,The KND Tools & Equipments,Coimbatore,Tamil Nadu,N/A,N/A,Information Unavailable,Tools and air compressor equipment
124,Compressors - Air Compressors,Bimpex Machines Private Limited,Mumbai,Maharashtra,N/A,N/A,Information Unavailable,Machine and air compressor manufacturing
125,Compressors - Compressors,Integrated Engineers & Contractors,Delhi,Delhi,N/A,N/A,Information Unavailable,Engineering and contracting services
126,Compressors - Air Compressors,Aar Vee Pneumatic Services,Hyderabad,Telangana,N/A,N/A,Information Unavailable,Pneumatic services and air compressors
127,Compressors - Air Compressors,Unik Pneumatic Engineering Company Private Limited,Hyderabad,Telangana,N/A,N/A,Information Unavailable,Pneumatic engineering and air compressors
128,Compressors - Air Compressors,Metro Engineering Equipments,Coimbatore,Tamil Nadu,N/A,N/A,Information Unavailable,Engineering equipment and air compressors
129,Compressors - Air Compressors,R.D. Dutta & Company Private Limited,New Delhi,Delhi,N/A,N/A,Information Unavailable,Industrial equipment and air compressors
130,Compressors - Compressed Air Systems,A-1 Air & Gas Company,Mumbai,Maharashtra,N/A,N/A,Information Unavailable,Air and gas compression systems
131,Compressors - Compressors,Maxbee Industries,Coimbatore,Tamil Nadu,N/A,N/A,Information Unavailable,Industrial compressor manufacturing
132,Compressors - Air Compressors,Esar Equipments,Coimbatore,Tamil Nadu,N/A,N/A,Information Unavailable,Equipment and air compressor manufacturing
133,Compressors - Air Compressors,Precimax CNC Engineers,Trichy,Tamil Nadu,N/A,N/A,Information Unavailable,CNC engineering and air compressors
134,Compressors - Air Compressors,Kool Tech Engineers,New Delhi,Delhi,N/A,N/A,Information Unavailable,Technical engineering and air compressors
135,Compressors - Compressors,Arun Engineering Works,Namakkal,Tamil Nadu,N/A,N/A,Information Unavailable,Engineering works and compressor manufacturing
136,Compressors - Air Compressor,Karan Associates Company,New Delhi,Delhi,N/A,N/A,Information Unavailable,Air compressor associates and services
137,Compressors - Distributor/Supplier,Multivista Global Private Limited,Chennai,Tamil Nadu,+91 44-42030400,N/A,N/A,Global distribution and supply services
138,Compressors - Related Industry/Component Supplier,AL-CAN EXPORTS PVT. LTD.,Thane,Maharashtra,N/A,vijay@alcanexports.com,N/A,Export and component supply services
139,Compressors - Related Industry/Component Supplier,ALFA PEB LTD.,Bangalore,Karnataka,N/A,enquiry@asbs.in,N/A,Pre-engineered building and components
140,Compressors - Related Industry/Component Supplier,ALP OVERSEAS PVT. LTD.,Gurgaon,Haryana,N/A,madhushri@alpaeroflex.com,N/A,Overseas component supply services
